Claim_ID,Claim_Text,Evidence_Type,Evidence_Source,Verification_Status,Visual_Required,Notes
C0,"Reward-trained low-dimensional motif selection improves held-out ORBIT user accuracy over the best fixed motif under paired inputs and budgets",experiment,"EXP33 official ORBIT CLU-VE; paired user-level bootstrap and sign/permutation test",planned,yes,"Primary endpoint is frame accuracy averaged within user before inference"
C1,"Benefits are mechanism-specific rather than generic ensembling",mixed,"EXP33 actuator disagreement; quality/shot/occlusion strata; clamp delay and action-shuffle interventions",planned,yes,"Requires directionally specific effects and Holm correction"
C2,"A high-rank E/I carrier retains at least 90% of controller gain with closed low-dimensional dynamics and normal contraction",experiment,"EXP34 participating-carrier comparison; closure and perturbation audit",planned,yes,"Cannot be supported by matrix rank alone"
C3,"The method improves very-low-shot accuracy versus personalization compute relative to gradient adaptation",mixed,"ORBIT 1/2/4/8/16-shot sweep; MACs wall time and mutable-parameter audit; LN-Tune/linear-head baselines",planned,yes,"Same frozen backbone and support tape"
C4,"ORBIT is a real-world personalized few-shot video benchmark with causal test constraints",citation,"Massiceti et al. ICCV 2021 plus official ORBIT protocol",verified,no,"Official source and code snapshot recorded in provenance"
C5,"Reusable dynamical motifs and gated fast-weight memories are plausible building blocks but do not establish actuator selection",citation,"Driscoll et al. 2024; Gated DeltaNet 2024/2026; Mamba-3 2026",verified,no,"Positioning only, not empirical support for C0"
